{
  "bundle_schema_version": 1,
  "status": "confirmed",
  "event_hash": "aabbccdd00112233445566778899aabbccdd00112233445566778899aabbccdd",
  "merkle_proof": {
    "leaf_index": 0,
    "siblings": [],
    "root": "aabbccdd00112233445566778899aabbccdd00112233445566778899aabbccdd"
  },
  "anchors": [],
  "partial_anchors_reason": []
}
